{
  "schema_version": "1.0",
  "registry_id": "OSONG-FIELD-REGISTRY-V23",
  "crs": "EPSG:4326",
  "fields": [
    {
      "field_id": "OSONG-FIELD-DEMO-001",
      "owner_user_id": "USER-DEMO-001",
      "display_name": "오송 미호강 북측 데모 농경지 1",
      "registration_status": "demo_registered",
      "geometry_accuracy": "osm_landuse_farmland_not_cadastral",
      "geometry": {
        "type": "Polygon",
        "coordinates": [
          [
            [
              127.30209250000001,
              36.5836162
            ],
            [
              127.30139,
              36.5851402
            ],
            [
              127.3015097,
              36.58622580000001
            ],
            [
              127.3024625640795,
              36.58749391819179
            ],
            [
              127.30598320477422,
              36.58754401942998
            ],
            [
              127.30672640000002,
              36.5853084
            ],
            [
              127.3069729,
              36.5844277
            ],
            [
              127.30675099999999,
              36.58415060000001
            ],
            [
              127.30209250000001,
              36.5836162
            ]
          ]
        ]
      },
      "derived_metrics": {
        "area_m2": 174207.6,
        "centre_wgs84": [
          127.304079664,
          36.5856050535
        ],
        "bounds_wgs84": [
          127.30139,
          36.5836162,
          127.3069729,
          36.5875440194
        ],
        "official_flood_intersection_area_m2": 148091.1,
        "official_flood_intersection_percent": 85.0084,
        "official_flood_intersection_source": "environment_ministry_national_river_100_year_extent"
      },
      "asset_binding": {
        "scene_zone_id": "OSONG-MIHO-REGION",
        "scene_pack_id": "OSONG-MIHO-SCENE-PACK-V23",
        "camera_profile_id": "V23-OSONG-FIELD-DEMO-001-CAMERA",
        "preparation_status": "ready"
      },
      "shelter": {
        "shelter_id": "OSONG-EUP-WELFARE-CENTER",
        "name": "오송읍복지회관",
        "location_wgs84": [
          127.3241937,
          36.60890936
        ],
        "distance_m": 3150.7,
        "source": "생활안전지도 재해구호시설 API"
      },
      "source": {
        "provider": "OpenStreetMap contributors",
        "element_type": "way",
        "element_id": 378002205,
        "tag": "landuse=farmland",
        "derivation": "V11 representative OSM farmland clipped 3 m inside the pilot AOI"
      },
      "limitations": [
        "This is an OSM agricultural land-cover polygon, not a cadastral ownership parcel.",
        "Replace this geometry with the user's registered boundary before production use."
      ]
    },
    {
      "field_id": "OSONG-FIELD-DEMO-002",
      "owner_user_id": "USER-DEMO-002",
      "display_name": "오송 미호강 북측 데모 농경지 2",
      "registration_status": "demo_registered",
      "geometry_accuracy": "osm_landuse_farmland_not_cadastral",
      "geometry": {
        "type": "Polygon",
        "coordinates": [
          [
            [
              127.3162441,
              36.5805533
            ],
            [
              127.3167537,
              36.5806726
            ],
            [
              127.3173554,
              36.5807721
            ],
            [
              127.31818,
              36.580809
            ],
            [
              127.3184136,
              36.5808034
            ],
            [
              127.3184631,
              36.580468
            ],
            [
              127.3191497,
              36.5805277
            ],
            [
              127.3193561,
              36.5805845
            ],
            [
              127.3194406,
              36.580811
            ],
            [
              127.3197312,
              36.5807988
            ],
            [
              127.3202432,
              36.5807608
            ],
            [
              127.3207619,
              36.5806659
            ],
            [
              127.3209714,
              36.5806102
            ],
            [
              127.3209799,
              36.580575
            ],
            [
              127.3208718,
              36.5804786
            ],
            [
              127.3207721,
              36.5794501
            ],
            [
              127.3206099,
              36.5793185
            ],
            [
              127.3205339,
              36.5793119
            ],
            [
              127.3161797,
              36.580393
            ],
            [
              127.3162441,
              36.5805533
            ]
          ]
        ]
      },
      "derived_metrics": {
        "area_m2": 40188.7,
        "centre_wgs84": [
          127.3190286379,
          36.5802077391
        ],
        "bounds_wgs84": [
          127.3161797,
          36.5793119,
          127.3209799,
          36.580811
        ],
        "official_flood_intersection_area_m2": 40188.4,
        "official_flood_intersection_percent": 99.9994,
        "official_flood_intersection_source": "environment_ministry_national_river_100_year_extent"
      },
      "asset_binding": {
        "scene_zone_id": "OSONG-MIHO-REGION",
        "scene_pack_id": "OSONG-MIHO-SCENE-PACK-V23",
        "camera_profile_id": "V23-OSONG-FIELD-DEMO-002-CAMERA",
        "preparation_status": "ready"
      },
      "shelter": {
        "shelter_id": "OSONG-EUP-WELFARE-CENTER",
        "name": "오송읍복지회관",
        "location_wgs84": [
          127.3241937,
          36.60890936
        ],
        "distance_m": 3218.4,
        "source": "생활안전지도 재해구호시설 API"
      },
      "source": {
        "provider": "OpenStreetMap contributors",
        "element_type": "way",
        "element_id": 1546898825,
        "tag": "landuse=farmland",
        "derivation": "Unmodified closed OSM way from the archived V11 Overpass response"
      },
      "limitations": [
        "This is an OSM agricultural land-cover polygon, not a cadastral ownership parcel.",
        "Replace this geometry with the user's registered boundary before production use."
      ]
    },
    {
      "field_id": "OSONG-FIELD-DEMO-003",
      "owner_user_id": "USER-DEMO-003",
      "display_name": "오송 미호강 북측 데모 농경지 3 (침수범위 교차)",
      "registration_status": "demo_registered",
      "geometry_accuracy": "osm_landuse_farmland_not_cadastral",
      "geometry": {
        "type": "Polygon",
        "coordinates": [
          [
            [
              127.3059528,
              36.6093863
            ],
            [
              127.307464,
              36.6065257
            ],
            [
              127.3086955,
              36.6069529
            ],
            [
              127.3072159,
              36.6098063
            ],
            [
              127.3059528,
              36.6093863
            ]
          ]
        ]
      },
      "derived_metrics": {
        "area_m2": 41658.3,
        "centre_wgs84": [
          127.3073291351,
          36.6081721225
        ],
        "bounds_wgs84": [
          127.3059528,
          36.6065257,
          127.3086955,
          36.6098063
        ],
        "official_flood_intersection_area_m2": 41658.3,
        "official_flood_intersection_percent": 100.0,
        "official_flood_intersection_source": "environment_ministry_national_river_100_year_extent"
      },
      "asset_binding": {
        "scene_zone_id": "OSONG-MIHO-REGION",
        "scene_pack_id": "OSONG-MIHO-SCENE-PACK-V23",
        "camera_profile_id": "V23-OSONG-FIELD-DEMO-003-CAMERA",
        "preparation_status": "ready"
      },
      "shelter": {
        "shelter_id": "OSONG-EUP-WELFARE-CENTER",
        "name": "오송읍복지회관",
        "location_wgs84": [
          127.3241937,
          36.60890936
        ],
        "distance_m": 1511.0,
        "source": "생활안전지도 재해구호시설 API"
      },
      "source": {
        "provider": "OpenStreetMap contributors",
        "element_type": "way",
        "element_id": 662073267,
        "tag": "landuse=farmland",
        "derivation": "Unmodified closed OSM way selected by official 100-year flood-extent intersection"
      },
      "limitations": [
        "This is an OSM agricultural land-cover polygon, not a cadastral ownership parcel.",
        "Replace this geometry with the user's registered boundary before production use."
      ]
    }
  ]
}
